[
  {
    "id": "s7-041",
    "source": "heard-2007",
    "name": "AJAX",
    "card_type": "warrior",
    "element": "Earth",
    "set": 7,
    "collector": "041",
    "culture": "Greek",
    "traits": [
      "Warrior",
      "Male"
    ],
    "life": 10,
    "speed": 3,
    "experience": 3,
    "damage": 1,
    "initiative": 0,
    "hands": 0,
    "weapon_damage": 0,
    "grid_raw": "+1 +1 –1 –1 � –2",
    "grid": null,
    "abilities": [
      {
        "name": "Avoithitos",
        "type": "static",
        "text": "You cannot gain life from your card abilities. You cannot use abilities on deity cards."
      },
      {
        "name": "Sinthlipsi",
        "type": "static",
        "text": "When you hit, if any of the dice of the attack roll are a 1, deal 1 damage to the attacker and defender."
      }
    ],
    "flavor": "“Aias, son of Telamon, and Bulwark of the Achaeans, was first to break a battalion of Trojans, and to bring a light of deliverance to his comrades,” – Homer, Iliad 6.5",
    "illustrator": "Mark Poole",
    "parse_confidence": "clean",
    "needs_review": [],
    "raw_source_text": "AJAX (Earth) 10 Life 3 Speed +1 +1 –1 3 Experience –1 � 1 Damage –2 Greek • Warrior • Male Avoithitos: You cannot gain life from your card abilities. You cannot use abilities on deity cards. Sinthlipsi: When you hit, if any of the dice of the attack roll are a 1, deal 1 damage to the attacker and defender. “Aias, son of Telamon, and Bulwark of the Achaeans, was first to break a battalion of Trojans, and to bring a light of deliverance to his comrades,” – Homer, Iliad 6.5 Illustration: Mark Poole 7 41/100"
  },
  {
    "id": "s7-081",
    "source": "heard-2007",
    "name": "BRUTUS",
    "card_type": "warrior",
    "element": "Metal",
    "set": 7,
    "collector": "081",
    "culture": "Trojan",
    "traits": [
      "Warrior",
      "Male"
    ],
    "life": 7,
    "speed": 3,
    "experience": 7,
    "damage": 1,
    "initiative": 0,
    "hands": 0,
    "weapon_damage": 0,
    "grid_raw": "+0 � +1 –1",
    "grid": null,
    "abilities": [
      {
        "name": "Enisxisi",
        "type": "static",
        "text": "While you have a support card in a space in your basic attack grid, your attacks deal +1 damage."
      },
      {
        "name": "Raze",
        "type": "action",
        "text": "Discard a support card in a space in your basic attack grid."
      }
    ],
    "flavor": "The mythical founder of Britain, Brutus fled Italy, liberated Trojan slaves in Greece, and followed divine visions to his new homeland.",
    "illustrator": "beet",
    "parse_confidence": "clean",
    "needs_review": [],
    "raw_source_text": "BRUTUS (Metal) 7 Life 3 Speed +0 7 Experience � +1 1 Damage –1 Trojan • Warrior • Male Enisxisi: While you have a support card in a space in your basic attack grid, your attacks deal +1 damage. Raze – Action: Discard a support card in a space in your basic attack grid. The mythical founder of Britain, Brutus fled Italy, liberated Trojan slaves in Greece, and followed divine visions to his new homeland. Illustration: beet 7 81/100"
  },
  {
    "id": "s3-061",
    "source": "heard-2007",
    "name": "T�A�Ú�KA WITKÓ",
    "card_type": "warrior",
    "element": "Fire",
    "set": 3,
    "collector": "061",
    "culture": "Native American",
    "traits": [
      "Warrior",
      "Male"
    ],
    "life": 7,
    "speed": 3,
    "experience": 4,
    "damage": 1,
    "initiative": 0,
    "hands": 0,
    "weapon_damage": 0,
    "grid_raw": "+1 +2 +1 � –2",
    "grid": null,
    "abilities": [
      {
        "name": "Tókhel �’a�phí�a �ni",
        "type": "static",
        "text": "While you have 3 or less life, all of your rolls gain +2."
      }
    ],
    "flavor": "Crazy Horse led the counter-attack that demolished Gerge Custer’s cavalry regiment during the Battle of the Little Bighorn, leaving not a single man alive.",
    "illustrator": "Greg Staples",
    "parse_confidence": "clean",
    "needs_review": [],
    "raw_source_text": "T�A�Ú�KA WITKÓ (Fire) 7 Life +1 3 Speed +2 +1 4 Experience � –2 1 Damage Native American • Warrior • Male Tókhel �’a�phí�a �ni: While you have 3 or less life, all of your rolls gain +2. Crazy Horse led the counter-attack that demolished Gerge Custer’s cavalry regiment during the Battle of the Little Bighorn, leaving not a single man alive. Illustration: Greg Staples 3 61/100"
  },
  {
    "id": "s3-P19-100",
    "source": "heard-2007",
    "name": "CHAN ZHANG",
    "card_type": "weapon",
    "element": "unknown",
    "set": 3,
    "collector": "P19/100",
    "culture": "Chinese",
    "traits": [
      "Weapon",
      "Bludgeon/Polearm"
    ],
    "life": 0,
    "speed": 0,
    "experience": 0,
    "damage": 0,
    "initiative": 7,
    "hands": 2,
    "weapon_damage": 1,
    "grid_raw": "+0 +0 +0 +0 +0 +0 +0 � +0 +0 +0 +0",
    "grid": null,
    "abilities": [
      {
        "name": "Feng Mo Zhang Fa",
        "type": "static",
        "text": "Twice each turn, after an attack misses you, you may immediately make an attack against the attacker, if possible. The monk cudgel made famous by Lu Zhi Shen, the tattooed monk, is used to disarm opponents or break their weapons while raining blows upon all parts of their body."
      }
    ],
    "flavor": "",
    "illustrator": "Szucs Gregory",
    "parse_confidence": "partial",
    "needs_review": [
      "flavor"
    ],
    "raw_source_text": "(7) CHAN ZHANG (1) +0 +0 +0 +0 +0 +0 +0 � +0 +0 +0 +0 Chinese • Weapon • Bludgeon/Polearm (2 Hands) Feng Mo Zhang Fa: Twice each turn, after an attack misses you, you may immediately make an attack against the attacker, if possible. The monk cudgel made famous by Lu Zhi Shen, the tattooed monk, is used to disarm opponents or break their weapons while raining blows upon all parts of their body. Illustration: Szucs Gregory 3 P19/100"
  },
  {
    "id": "s6-028",
    "source": "heard-2007",
    "name": "FLINTLOCK PISTOL",
    "card_type": "weapon",
    "element": "unknown",
    "set": 6,
    "collector": "028",
    "culture": "Irish",
    "traits": [
      "Pirate",
      "Weapon",
      "Ranged"
    ],
    "life": 0,
    "speed": 0,
    "experience": 0,
    "damage": 0,
    "initiative": 9,
    "hands": 1,
    "weapon_damage": 0,
    "grid_raw": "�",
    "grid": null,
    "abilities": [
      {
        "name": "Urchar Maith",
        "type": "reveal",
        "text": "Choose an opponent. You and the chosen opponent each roll two dice and add the total initiative of your respective cards to your rolls. If your total is higher, discard this card and deal 2 damage to the opponent."
      }
    ],
    "flavor": "Coming under attack from Captain Barnet, a pirate turned pirate-hunter, Calico Jack and his men cowered below decks while Anne Bonny and Mary Read fought.",
    "illustrator": "Steven Belledin",
    "parse_confidence": "clean",
    "needs_review": [],
    "raw_source_text": "(9) FLINTLOCK PISTOL (0) � Irish � Pirate � Weapon � Ranged (1 Hand) Urchar Maith – Reveal: Choose an opponent. You and the chosen opponent each roll two dice and add the total initiative of your respective cards to your rolls. If your total is higher, discard this card and deal 2 damage to the opponent. Coming under attack from Captain Barnet, a pirate turned pirate-hunter, Calico Jack and his men cowered below decks while Anne Bonny and Mary Read fought. Illustration: Steven Belledin 6 28/100"
  },
  {
    "id": "s7-068",
    "source": "heard-2007",
    "name": "�EREV APPOLONIUS",
    "card_type": "weapon",
    "element": "unknown",
    "set": 7,
    "collector": "068",
    "culture": "Tribes of Israel",
    "traits": [
      "Weapon",
      "Sword"
    ],
    "life": 0,
    "speed": 0,
    "experience": 0,
    "damage": 0,
    "initiative": 5,
    "hands": 1,
    "weapon_damage": 0,
    "grid_raw": "+1 –1 � +0",
    "grid": null,
    "abilities": [
      {
        "name": "�addîq",
        "type": "static",
        "text": "Attacks with this weapon deal +1 damage if the defender does not have an inspiration card in play."
      },
      {
        "name": "Q�de�",
        "type": "static",
        "text": "You may use two inspiration cards."
      }
    ],
    "flavor": "Meeting Appolonius in battle, Judah slew him and took his sword. Judah used the Seleucid sword from that day until his death.",
    "illustrator": "Michael Kaluta",
    "parse_confidence": "partial",
    "needs_review": [
      "weapon_damage"
    ],
    "raw_source_text": "(5) �EREV APPOLONIUS +1 –1 � +0 Tribes of Israel • Weapon • Sword (1 Hand) �addîq: Attacks with this weapon deal +1 damage if the defender does not have an inspiration card in play. Q�de�: You may use two inspiration cards. Meeting Appolonius in battle, Judah slew him and took his sword. Judah used the Seleucid sword from that day until his death. Illustration: Michael Kaluta 7 68/100"
  },
  {
    "id": "s6-099",
    "source": "heard-2007",
    "name": "YARIK",
    "card_type": "armor",
    "element": "unknown",
    "set": 6,
    "collector": "099",
    "culture": "Turkish",
    "traits": [
      "Amor",
      "Torso"
    ],
    "life": 0,
    "speed": 0,
    "experience": 0,
    "damage": 0,
    "initiative": 4,
    "hands": 0,
    "weapon_damage": 0,
    "grid_raw": "",
    "grid": null,
    "abilities": [
      {
        "name": "Gurur",
        "type": "static",
        "text": "Any opponent who rolls doubles is your rival."
      },
      {
        "name": "Zhatta fit",
        "type": "static",
        "text": "Your defense rolls gain +1. Once each turn, when you are attacked, each time a die of the attack roll is re-rolled, you may re-roll one die of your defense roll."
      }
    ],
    "flavor": "Made from chain and reinforced with light metal plates, the armor of the Sultan reflected the glory of his mighty empire.",
    "illustrator": "Drew Baker",
    "parse_confidence": "partial",
    "needs_review": [
      "source_typo"
    ],